job_title,company_name,company_size,location,salary_min,salary_max,salary_currency,experience_required,skills,job_type,job_level,posted_date,deadline,job_description,benefits,source
"Customer Solutions Consultant, Platform, Google Cloud",Google,,Vietnam,,,,6.0,"['Rust', 'Scala', 'GCP', 'AI', 'Security']",Full-time,Not Applicable,2026-06-03,,"Please visit this Google Careers posting for the Vietnamese-translated version of this role.
Note: Google's hybrid workplace includes remote roles.
Remote location: Vietnam.
Minimum qualifications:
Bachelor's degree or equivalent practical experience.
6 years of experience with cloud native architecture in a customer-facing or support role.
Experience with cloud engineering, on-premise engineering, virtualization, or containerization platforms.
Experience engaging with, or presenting to, technical stakeholders or executive leaders.
Experience in programming languages, debugging, systems design, prototyping, demos, or customer workshops.
Preferred qualifications:
Experience promoting technical solutions in Cloud AI.
Experience driving the entire business cycle (e.g., defining the delivery and consumption plan and transitioning it for execution).
Experience with security concepts (e.g., encryption, identity management, access control, attack vectors).
Experience building technical strategies to uncover new workloads with customers.
Experience migrating applications and services to cloud platforms.
About The Job
The Google Cloud Platform team helps customers transform and build what's next for their business — all with technology built in the cloud. Our products are developed for security, reliability and scalability, running the full stack from infrastructure to applications to devices and hardware. Our teams are dedicated to helping our customers — developers, small and large businesses, educational institutions and government agencies — see the benefits of our technology come to life. As part of an entrepreneurial team in this rapidly growing business, you will play a key role in understanding the needs of our customers and help shape the future of businesses of all sizes use technology to connect with customers, employees and partners.
As a Platform Customer Solutions Consultant, you will partner with sales teams to differentiate Google Cloud Platform (GCP) to the customers and serve as the customer’s primary technical partner and advisor, engaging in technical-led conversations to understand business issues. You will troubleshoot technical questions and roadblocks, engage in proofs-of-concepts and demos, and use the expertise to architect cross-pillar cloud solutions that solve business issues. You will drive the technical win and define the delivery and consumption plans to engage with technical and business leaders, and present solutions. You will focus on identifying, pursuing, and winning new business workloads and driving engagement within existing ones.
Google Cloud accelerates every organization’s ability to digitally transform its business and industry. We deliver enterprise-grade solutions that leverage Google’s technology, and tools that help developers build more sustainably. Customers in more than 200 countries and territories turn to Google Cloud as their trusted partner to enable growth and solve their most critical business problems.
Responsibilities
Develop and own the technical account plan and strategy, participate in planning and support the business goals.
Combine sales, programming, and solutions architecture expertise to prove the value of Google Cloud Platform (GCP) across the portfolio through demos, pilots and workshops.
Architect cross-pillar solutions, drive technical wins, and define initial delivery plans for customers, and continue to lead the technical engagement in the solution phase.
Facilitate the post-sales transition by supporting pricing activities and transitioning the final delivery plan to implementation teams.
Maintain awareness of progress against the delivery plan, provide support to cross-functional teams during ramp, delivery, migration or implementation phases.
Google is proud to be an equal opportunity workplace and is an affirmative action employer. We are committed to equal employment opportunity regardless of race, color, ancestry, religion, sex, national origin, sexual orientation, age, citizenship, marital status, disability, gender identity or Veteran status. We also consider qualified applicants regardless of criminal histories, consistent with legal requirements. See also Google's EEO Policy and EEO is the Law. If you have a disability or special need that requires accommodation, please let us know by completing our Accommodations for Applicants form .",,linkedin
IT Manager (Hanoi),CNK Consulting Vietnam,,"Hanoi, Hanoi, Vietnam",,,,7.0,"['Security', 'Cybersecurity']",Full-time,Not Applicable,2026-05-11,,"Job Description
Position Summary
The IT Manager is responsible for managing the company's IT infrastructure, systems, and digital transformation initiatives.
Key Responsibilities
Manage IT systems including hospital systems, ERP, and other internal platforms.
Ensure system stability, cybersecurity, and data protection.
Lead the IT team and manage daily IT operations.
Coordinate with vendors and headquarters on system implementation.
Manage IT infrastructure and technology upgrades.
Control IT budgets and ensure efficient resource utilization.
Requirements
Bachelors degree in Information Technology, Computer Science, or related field.
Minimum 7 years of IT experience with at least 3 years in a managerial role.
Experience managing enterprise systems.
Strong leadership and project management skills.
Good English communication skills.
Benefits
Competitive salary package.
Professional working environment.
Opportunities for technology innovation.
Contact: hang@cnk-consulting.com.vn (Ms. Lia Thu Hang)
﻿﻿
Note: ﻿We appreciate all applications; however, only shortlisted candidates will be contacted","Competitive salary package.
Professional working environment.
Opportunities for technology innovation.
Contact: hang@cnk-consulting.com.vn (Ms. Lia Thu Hang)
﻿﻿
Note: ﻿We appreciate all applications; however, only shortlisted candidates will be contacted",linkedin
"Client Success Representative (Remote within APAC region, Contract)",INFUSE,,Vietnam,,,,,"['Scala', 'Machine Learning', 'Security']",Full-time,Mid-Senior level,2026-05-11,,"OUR HIRING PROCESS:
We will review your application against our job requirements. We do not employ machine learning technologies during this phase as we believe every human deserves attention from another human. We do not think machines can evaluate your application quite like our seasoned recruiting professionals—every person is unique. We promise to give your candidacy a fair and detailed assessment.
We may then invite you to submit a video interview for the review of the hiring manager. This video interview is often followed by a test or short project that allows us to determine whether you will be a good fit for the team.
At this point, we will invite you to interview with our hiring manager and/or the interview team. Please note: We do not conduct interviews via text message, Telegram, etc. and we never hire anyone into our organization without having met you face-to-face (or via Zoom). You will be invited to come to a live meeting or Zoom, where you will meet our INFUSE team.
From there on, it’s decision time! If you are still excited to join INFUSE and we like you as much, we will have a conversation about your offer. We do not make offers without giving you the opportunity to speak with us live.
INFUSE is committed to complying with applicable data privacy and security laws and regulations. For more information, please see our Privacy Policy
Are you driven by the desire to deliver exceptional client experiences and thrive in a dynamic environment? At INFUSE, we're seeking a passionate Client Success Specialist to join our team, where your efforts directly contribute to our clients' satisfaction and our company's success. This position offers an enriching path to professional growth and the unique opportunity to work with a variety of industries, ensuring no two days are the same. INFUSE has built a reputation as a beloved employer by prioritizing employee satisfaction and creating a workplace where everyone feels valued and connected. Joining our team means becoming part of a supportive community that celebrates every success and encourages continuous improvement. You'll discover how our employees love their jobs, driven by the meaningful connections they make and the positive impact they have on our clients' businesses.
Key Responsibilities
Build and maintain strong, long-lasting client relationships
Ensure the timely and successful delivery of our solutions according to client needs and objectives
Communicate clearly the progress of monthly/quarterly initiatives to internal and external stakeholders
Identify and grow opportunities within the territory and collaborate with sales teams to ensure growth attainment
Assist with challenging client requests or issue escalations as needed
Provide assistance across a variety of administrative and operational tasks, such as data entry, updating internal systems, or managing schedules.
Requirements
Proven track record of managing client relationships, preferably in a related field such as hospitality, client success, or sales
Strong communication and interpersonal skills
Can handle various tasks with attention to detail, managing priorities effectively in a fast-paced environment.
Empathetic understanding of client needs and ability to address them effectively
Ability to address challenges and proactively offer solutions.
If you're passionate about building meaningful relationships and delivering top-notch client experiences, we'd love to hear from you. Apply now to embark on a rewarding career journey with INFUSE, where your ambitions and contributions are recognized and valued. Don't miss your chance to be part of a team that genuinely enjoys making a difference. Submit your application today!
We are an Equal Opportunity Employer. We make hiring decisions based on qualifications, merit, and business needs. We do not discriminate on the basis of race, color, religion, sex (including pregnancy, sexual orientation, and gender identity), national origin, age, disability, genetic information, or any other characteristic protected under applicable law. We welcome applicants from all backgrounds and believe that diversity of experience, culture, and perspective makes us stronger.",,linkedin
Data Center Technician - Da Nang - On-site,Reboot Monkey,,"Đà Nang, Da Nang City, Vietnam",,,,3.0,"['Linux', 'Excel', 'VMware', 'Hyper-V', 'Networking', 'Firewall', 'VPN', 'Security']",Full-time,Entry level,2026-03-10,,"Reboot Monkey is a global leader in IT solutions, specializing in data center management that simplifies your IT operations. We provide hosting space, future-proof upgrades, and 24/7 support through our smart or remote hands, ensuring seamless, secure, and sustainable service. Our fully remote, round-the-clock management frees businesses from supervision hassles, setting new benchmarks in data center solutions. We’re seeking skilled Freelance Data Center Technicians to join our growing team. If you have expertise in data center operations and want flexible work, we’d love to hear from you.
Job Overview:
As a Freelance Data Center Technician,
you will play a key role in delivering on-demand support to our global data centers. Your responsibilities will include hardware installation, troubleshooting complex issues, and managing network operations, ensuring optimal performance and reliability. We’re looking for someone with deep expertise in data center equipment and software who can work independently while collaborating with remote teams. In this role, you’ll be essential to maintaining smooth, secure, and efficient data center operations, contributing to our high standards of service excellence.
Key Responsibilities:
Install, configure, and maintain servers, networking equipment, and other hardware to ensure optimal performance and maximum uptime, facilitating seamless operations within the data center.
Monitor data center operations both remotely and on-site, quickly diagnosing and resolving hardware, software, and connectivity issues to minimize downtime and maintain service reliability.
Configure, manage, and troubleshoot networking devices, including Cisco and Juniper routers, switches, and firewalls, to ensure secure and efficient network operations that align with organizational standards.
Manage and troubleshoot both Linux and Windows-based systems, performing essential updates, patches, and security enhancements to keep systems secure and up-to-date.
Document all installations, repairs, maintenance tasks, and system performance, providing comprehensive reports to the remote management team to ensure transparency and accountability in operations.
Implement and maintain security protocols to protect the integrity of the data center infrastructure, ensuring compliance with industry standards and best practices for data security.
Collaborate with remote IT teams, vendors, and stakeholders to enhance data center operations, actively participating in the planning and execution of projects that drive efficiency and innovation.
What We Offer:
Flexibility: Work around your existing freelance or permanent job. You choose the tickets you want to pick up, with no minimum hour commitment.
Professional Environment: Join a professional work environment where you can reconnect with the practical side of IT.
Competitive Compensation: We offer competitive rewards for your compensation and efforts.
Growth Opportunities: Work with compelling clients and seize opportunities to grow in your field.
Education:
Associate or Bachelor's degree in Computer Science, Information Technology, or a related field is preferred but not required.
Experience:
3+ years of experience in data center operations, with a strong focus on independent or freelance projects.
Technical Skills:
Extensive hands-on experience with Cisco and Juniper networking devices.
Strong proficiency in managing and troubleshooting Windows and Linux-based systems.
Solid understanding of networking principles (TCP/IP, DNS, VPN, VLANs).
Experience with virtualization technologies such as VMware or Hyper-V is a plus.
Certifications:
Valid certifications like Cisco CCNA/CCNP, Juniper JNCIA/JNCIS, or CompTIA Linux+ are highly desirable.
General Requirements:
Ability to travel to various data center locations on short notice.
Flexibility to work outside regular hours, including nights and weekends if required.
Must have access to necessary tools and equipment to perform data center tasks.
Strong problem-solving skills, with the ability to work independently and remotely.
Excellent communication skills for collaboration with remote teams.","Flexibility: Work around your existing freelance or permanent job. You choose the tickets you want to pick up, with no minimum hour commitment.
Professional Environment: Join a professional work environment where you can reconnect with the practical side of IT.
Competitive Compensation: We offer competitive rewards for your compensation and efforts.
Growth Opportunities: Work with compelling clients and seize opportunities to grow in your field.
Education:
Associate or Bachelor's degree in Computer Science, Information Technology, or a related field is preferred but not required.
Experience:
3+ years of experience in data center operations, with a strong focus on independent or freelance projects.
Technical Skills:
Extensive hands-on experience with Cisco and Juniper networking devices.
Strong proficiency in managing and troubleshooting Windows and Linux-based systems.
Solid understanding of networking principles (TCP/IP, DNS, VPN, VLANs).
Experience with virtualization technologies su...",linkedin
Assistant Manager Tech Infrastructure,adidas,,"Củ Chi, Ho Chi Minh City, Vietnam",,,,1.0,"['Scala', 'Express', 'ITIL']",Full-time,Not Applicable,2026-05-25,,"Market business expects solid and best in class infrastructure support services, service management and project delivery. The Assistant Manager Tech Infrastructure will contribute to seamless running of IT services (day to day support) as well as project delivery (opening, closing & revamp activities) across a specific adidas market/country.He/she is also supporting the service quality of all end user services (e.g. Connectivity, Service Desk, Onsite Support a.k.a. Field Services and End Device Management) in order to deliver the right level of cross functional- or team services and actively participating with the Domain Product Owners and Business Partners on any Infrastructure related project and support service.
Key Responsibilities
Continual Improvement: Expect to take part in continual improvement initiatives and collaborate with relevant Domain Service Owners to highlight and contribute towards improvement activities.
Relationship Management: Your scope will be within a specific adidas market where you will be expected to support in stakeholder engagement/communications. You will be updating stakeholders to ensure everyone is understanding and updated on agreed level of our service.
Service Level Management: Monitors and logs the actual service provided, compared to that required by service level agreements.
Project Management: In charge of various smaller infrastructure projects, which need to be executed on time, in full and in budget. You could be expected to engage with local vendors to ensure that contractual agreements are adhered to as well as monitoring vendor performance.
Service Management & Incident Management
Oversees external vendor incident management (support) process compliancy (ITIL standards) according to defined and agreed global process governance set by Product Domain
Continuously keep business stakeholders updated on elevated incidents.
Problem Management
Investigates problems in systems, processes, and services.
Assists with the implementation of agreed remedies and preventative measures.
Key Relationships:
Global Infrastructure (Tech Core) Service Owners for service improvements and vendor performance metrics
SPOC to local business team members around overall service performance & escalation mgmt.
External Service Providers for service review and service quality improvements.
Requisite Education And Experience / Minimum Qualifications
Four-year college or university degree with focus on Business Administration or IT orrelated areas, or equivalent combination of education and experience
Proficient spoken and written command of English
At least 3-year experience in IT
1 year of experience in relevant area
adidas celebrates diversity, supports inclusiveness and encourages individual expression in our workplace. We do not tolerate the harassment or discrimination toward any of our applicants or employees. We are an equal opportunity employer.",,linkedin
Chuyên viên Hỗ trợ – Helpdesk,NMS,,"Hanoi, Hanoi, Vietnam",,,,,[],Full-time,Not Applicable,1 year ago,,"MÔ TẢ CÔNG VIỆC
Quản lý hệ thống, xử lý lỗi, hỗ trợ người dùng, tư vấn nâng cấp hệ thống hoặc thiết bị thay thế.
Cài đặt, sửa chữa phần mềm, hệ điều hành.
Xử lý các trục trặc thông thường về hệ thống mạng, điện thoại analog và voip, wifi, điện, camera, cửa từ …
Giám sát hệ thống và các thiết bị mạng trong văn phòng.
Chưa có kinh nghiệm – > được đào tạo trước khi làm việc
YÊU CẦU KỸ NĂNG
Tốt nghiệp Đại học
Nhanh nhẹn chịu khó học hỏi.
Giao tiếp tốt
Tiếng Anh giao tiếp tốt.
Làm việc tại Thanh Hóa
QUYỀN LỢI
Mức thu nhập cạnh tranh
“NMS care” bảo hiểm dành riêng cho nhân viên NMS.
Nghỉ hè: Theo chính sách của công ty ( vào tháng 5 hàng năm).
Có cơ hội được xem xét nâng lương 2 lần 01 năm, tùy vào kết quả công việc.
Môi trường làm việc hiện đại, thân thiện.
Chính sách cho người lao động tuân theo “Bộ luật lao động” tại Việt Nam.",,linkedin
Presales Engineer – IT Infrastructure & SecurityHCM,HPT Vietnam Corporation,,"Ho Chi Minh City, Ho Chi Minh City, Vietnam",,,,,"['VMware', 'Security']",Full-time,Not Applicable,2025-08-12,,"Presales Engineer – IT Infrastructure & Security
Up to $1500 Hồ Chí Minh 19/04/2025 File CV mẫu
MÔ TẢ CÔNG VIỆC
Tư vấn giải pháp CNTT: Khảo sát nhu cầu khách hàng, phân tích yêu cầu và đề xuất mô hình, giải pháp công nghệ thông tin (network, security, server, storage, cloud...)
Hỗ trợ nhân viên kinh doanh tư vấn bán hàng và giới thiệu sản phẩm, dịch vụ cho khách hàng
Đầu mối quan hệ với các nhà sản xuất, kênh phân phối để POC và xây dựng giải pháp kỹ thuật cung cấp cho thị trường
Xây dựng các tài liệu kỹ thuật giới thiệu giải pháp, sản phẩm, dịch vụ công nghệ thông tin
Tham gia làm hồ sơ thầu.
Thực hiện các công việc phát triển sản phẩm và dịch vụ theo theo định hướng của công ty
YÊU CẦU CÔNG VIỆC
Tốt nghiệp đại học chuyên ngành CNTT
Tối thiểu 2 năm kinh nghiệm vị trí tư vấn, triển khai
Am hiểu sâu sắc một hoặc một số lĩnh vực liên quan đến công nghệ mạng, máy chủ, lưu trữ, ảo hóa – điện toán đám mây
Có kỹ năng giao tiếp và thuyết trình tốt bằng tiếng Anh
Ưu tiên ứng viên có kinh nghiệm & chứng chỉ:
Đã làm việc với các sản phẩm/giải pháp của Microsoft, VMware, IBM, Cisco, Juniper, Palo Alto.
Có một trong các chứng chỉ: MCSE, CCNP, VCP… là lợi thế
Kỹ năng mềm:
Giao tiếp, thuyết trình, đàm phán tốt.
Khả năng viết tài liệu kỹ thuật mạch lạc, rõ ràng.
Tư duy giải quyết vấn đề, xử lý tình huống linh hoạt.
QUYỀN LỢI
Review lương theo năng lực và kết quả công việc định kỳ hàng năm
Thưởng vinh danh nhân viên xuất sắc hàng quý, năm
Thưởng vào các dịp Lễ/Tết hàng năm
Tài trợ 100% chi phí tham gia các khóa học, thi chứng chỉ phục vụ cho công việc
Có nhiều cơ hội thăng tiến và phát triển nghề nghiệp
Được trang bị laptop làm việc hiện đại
Tổ chức nhiều hoạt động teambuilding, nghỉ hè hàng năm hấp dẫn
THÔNG TIN LIÊN HỆ
Các ứng viên quan tâm và mong muốn làm việc tại Công ty HPT vui lòng gửi hồ sơ ứng tuyển qua email: tuyendung@hpt.vn hoặc trực tiếp nộp đơn tại:
Tp. Hồ Chí Minh:
Chi nhánh HPT, Số 37 Nguyễn Trường Tộ, Phường 12, Quận 4, TP. Hồ Chí Minh",,linkedin
Fresher Manual testing (Web),VTI,,"Hanoi, Hanoi, Vietnam",,,,,['AWS'],Full-time,Not Applicable,2026-06-03,,"MÔ TẢ CÔNG VIỆC
Sẽ thực hiện các công việc của tester:
Tạo testview point, Scenario
Create IT, ST case
Excecute IT,ST
Được tào tạo chuyên môn về nghiệp vụ ERP, MES
YÊU CẦU
Có từ 6 tháng - 1.5 năm kinh nghiệm test.
Có kinh nghiệm và skill thực hiện test và viết test case tốt
Nhanh nhẹn, chủ động trong công việc, có thể làm việc độc lập
ĐÃI NGỘ
Tối thiểu 13 tháng lương 1 năm - chưa tính các khoản thưởng khác trong quá trình làm việc như thưởng theo KPI hiệu quả công việc, thưởng dự án và thưởng theo doanh thu.
Được khám sức khỏe định kỳ hàng năm và được đóng BHXH, BHYT, BHTN đầy đủ theo luật quy định
Hưởng chế độ nghỉ mát, teambuilding 4 lần/ 1 năm, và các hoạt động thể thao, giải trí phong phú bao gồm: các CLB Bơi, Yoga, Zumba, Kendo, yêu cầu bài hát qua radio nội bộ.
02 nhân viên xuất sắc nhất năm sẽ được thưởng một chuyến du lịch miễn phí đến các quốc gia như Nhật Bản, Đài Loan, Singapore..v.v.
Cơ hội thăng tiến, nâng cao thu nhập cho người có năng lực, tâm huyết và gắn bó lâu dài.
Được đào tạo tiếng Nhật miễn phí tại công ty.
Cơ hội được đào tạo để nâng cao nghiệp vụ chuyên môn. Cơ hội hỗ trợ thi các chứng chỉ về Cloud, AWS, PMF, PMP.
Giờ làm việc: từ 8h30 đến 17h30, từ thứ Hai đến thứ Sáu hàng tuần.
Ngày hết hạn: 08 tháng 6, 2026
Chi tiết công việc
Số Lượng
3
Địa Điểm
Hà Nội
Kinh Nghiệm
1 năm
Trình Độ
Fresher
Hình Thức
Toàn thời gian
Kỹ Năng
Manual testing (Web)",,linkedin
